ID_Requisito,Nombre_Requisito,Estado_Actual,Prioridad,Descripcion_Tecnica,Implementacion_Real,Tareas_Especificas_Codigo,Horas_Reales,Archivos_Implementados,Fecha_Completado
25O072-MAIN-001,Aplicación Flask Factory Pattern,COMPLETADO,CRITICA,DroneGeoApp class con dependency injection y gestión modular de servicios (255 líneas),Aplicación Flask robusta implementando patrón Factory con inicialización automática de componentes,1. Clase DroneGeoApp con Factory pattern líneas 36-78; 2. _initialize_components() líneas 99-137; 3. _detect_available_modules() líneas 139-158; 4. _register_blueprints() líneas 211-227; 5. Environment validation _validate_environment() líneas 80-85; 6. Hardware detection real vs fallback; 7. Waitress production server setup líneas 247-252,35 horas,src/main.py (255 líneas código real),2025-02-15
25O072-YOLO-DETECTOR-001,Detector YOLO 11 Coordinador Modular,COMPLETADO,CRITICA,YoloObjectDetector con componentes especializados ImageProcessor + YoloModelManager + ResultFormatter (220 líneas),Sistema detección objetos modular siguiendo Single Responsibility Principle,1. YoloObjectDetector coordinator clase líneas 19-47; 2. detect_objects() método principal líneas 54-106; 3. _process_detections() líneas 136-159; 4. _annotate_image() líneas 161-172; 5. Integración ImageProcessor línea 38; 6. Integración YoloModelManager línea 39; 7. Confidence/NMS threshold management líneas 206-220,25 horas,src/models/yolo_detector.py (220 líneas),2025-03-10
25O072-GEO-ANALYZER-001,Analizador Geográfico GPT-4 Vision OSINT,COMPLETADO,CRITICA,GeoAnalyzer con prompts especializados OSINT y contexto YOLO para análisis geográfico (371 líneas),Análisis geográfico inteligente usando GPT-4 Vision con instrucciones OSINT y contexto enriquecido,1. analyze_image() método principal líneas 51-81; 2. _get_osint_analysis_instructions() prompts especializados líneas 135-167; 3. _format_yolo_context() integración YOLO líneas 268-304; 4. _create_vision_request() GPT-4 Vision líneas 99-116; 5. _parse_json_response() parsing robusto líneas 240-252; 6. Provider fallback system líneas 35-49; 7. Geographic indicators extraction líneas 333-371,50 horas,src/models/geo_analyzer.py (371 líneas),2025-04-08
25O072-MISSION-PLANNER-001,Planificador Misiones LLM Inteligente,COMPLETADO,ALTA,LLMMissionPlanner orquestando CartographyManager + MissionDataProcessor + PromptGenerator (138 líneas),Planificador misiones usando LLM con procesamiento cartográfico GeoJSON,1. create_mission_from_command() método principal líneas 38-82; 2. _prepare_area_info() líneas 109-123; 3. Integración LLMClient línea 30; 4. Integración CartographyManager línea 31; 5. MissionDataProcessor línea 32; 6. PromptGenerator línea 33; 7. Mission validation líneas 133-138,20 horas,src/models/mission_planner.py (138 líneas),2025-05-20
25O072-YOLO-MODEL-MANAGER-001,Gestor Modelo YOLO con Auto-descarga,COMPLETADO,ALTA,YoloModelManager con detección múltiples paths y auto-descarga desde Ultralytics (173 líneas),Gestión ciclo vida modelo YOLO con inicialización automática y recuperación errores,1. initialize_model() método principal líneas 36-73; 2. _find_model_path() búsqueda múltiples ubicaciones líneas 75-89; 3. _try_auto_download() descarga automática líneas 91-114; 4. predict() execution líneas 116-132; 5. Class management get_class_names() líneas 134-141; 6. Model info get_model_info() líneas 161-173; 7. Constantes MODEL_PATHS líneas 22-26,22 horas,src/utils/yolo_model_manager.py (173 líneas),2025-03-18
25O072-UI-MODERN-001,Interfaz Usuario HTML5 Moderna,COMPLETADO,ALTA,Template HTML5 responsive con CSS Grid + animaciones + dark theme (989 líneas),Interface web moderna con diseño profesional y animaciones CSS avanzadas,1. HTML5 semantic structure líneas 1-50; 2. CSS variables sistema design líneas 10-29; 3. Background animations líneas 45-100; 4. Responsive grid layout líneas 150-250; 5. Interactive elements JavaScript líneas 400-600; 6. Dark theme professional líneas 31-44; 7. Font integration Google Fonts línea 8; 8. CSS animations keyframes líneas 700-900,60 horas,src/templates/index.html (989 líneas),2025-06-12
25O072-ANALYSIS-CONTROLLER-001,Controlador REST API Análisis Completo,COMPLETADO,ALTA,Flask Blueprint con endpoints análisis + chat contextual + session management (339 líneas),API REST completa para análisis de imágenes con sistema chat integrado,1. analyze() endpoint principal líneas 29-75; 2. analyze_yolo() endpoint YOLO líneas 106-131; 3. chat_question() endpoint chat líneas 149-175; 4. chat_history() líneas 177-198; 5. suggested_questions() líneas 200-221; 6. Session management _get_or_create_session_id() líneas 272-276; 7. Image encoding _get_encoded_image_for_chat() líneas 294-339,35 horas,src/controllers/analysis_controller.py (339 líneas),2025-04-12
25O072-ANALYSIS-SERVICE-001,Servicio Análisis Híbrido YOLO+GPT4,COMPLETADO,CRITICA,AnalysisService implementando análisis híbrido con contexto YOLO enriqueciendo GPT-4 (410 líneas),Lógica negocio análisis híbrido integrando YOLO detection con GPT-4 Vision contextual,1. analyze_image() workflow híbrido líneas 38-94; 2. _get_yolo_context_for_geographic_analysis() líneas 266-307; 3. _extract_geographic_indicators() líneas 352-410; 4. _get_prominent_objects() líneas 325-350; 5. analyze_objects_yolo() método YOLO puro líneas 96-146; 6. Image processing pipeline líneas 196-234; 7. Result enrichment y saving líneas 229-264,45 horas,src/services/analysis_service.py (410 líneas),2025-04-15
25O072-TESTING-MODULAR-001,Suite Testing Modular Organizada,COMPLETADO,ALTA,Testing suite organizada por módulos con runners independientes y mocks,Sistema testing completo organizado por responsabilidades con mock implementations,1. tests/controllers_test/ con 4 test files; 2. tests/models_test/ con 5 test files; 3. tests/services_test/ con 4 test files; 4. tests/utils_test/ con helpers; 5. tests/drones_test/ hardware tests; 6. tests/geo_test/ geospatial tests; 7. tests/processors_test/ multimedia; 8. Mock implementations reales,45 horas,tests/ (8 directorios + runners ~2000 líneas),2025-05-05
25O072-CHAT-CONTEXTUAL-001,Chat Contextual Post-Análisis Inteligente,COMPLETADO,ALTA,ChatService con gestión sesiones + contexto preservado + preguntas sugeridas,Sistema chat contextual inteligente que preserva contexto análisis con sugerencias,1. Session management store_analysis_context(); 2. Context preservation get_context_summary(); 3. Chat history get_chat_history(); 4. Suggested questions get_suggested_questions(); 5. Analysis context integration; 6. Clear history functionality; 7. Integration analysis_controller.py endpoints,28 horas,src/services/chat_service.py + analysis_controller.py endpoints (~400 líneas),2025-04-25
25O072-REQ-PEND-008,Setup Jetson AGX Infrastructure,PENDIENTE,CRITICA,Jetson AGX Orin + JetPack SDK + Docker support + 64GB RAM,Plataforma edge computing para LLMs locales - backbone del sistema,1. Adquisición Jetson AGX Orin; 2. Instalación JetPack 5.1+; 3. Setup Docker + NVIDIA Container Runtime; 4. Configuración red/SSH; 5. Testing GPU/Tensor cores; 6. Benchmarking inicial,2 semanas,Hardware + sistema base,
25O072-REQ-PEND-004,Autenticación JWT + Roles,PENDIENTE,ALTA,JWT library + UI login + middleware,Seguridad empresarial - agregar a sistema actual,1. Diseño roles (admin/operator/viewer); 2. JWT middleware Flask; 3. UI login en templates; 4. Modificar todos controllers; 5. Testing seguridad; 6. Documentación roles,2 semanas,"src/controllers/ (modificar todos), src/templates/ (agregar login)",
25O072-REQ-PEND-009,Despliegue LLMs en Jetson AGX,PENDIENTE,CRITICA,Modelos LLM optimizados ARM64 + TensorRT + Triton Server,LLMs funcionando en Jetson - core del sistema distribuido,"1. Selección modelos compatibles Jetson; 2. Optimización TensorRT; 3. Setup Triton Inference Server; 4. Configuración modelos (Llama, Mistral, Vision); 5. API REST endpoints; 6. Load balancing requests",3 semanas,Jetson AGX + modelos optimizados,
25O072-REQ-PEND-002,APIs Satelitales Reales,PENDIENTE,MEDIA,Google Earth API + Sentinel API + presupuesto €200/mes,Imágenes satelitales reales - reemplazar cache simulado,1. Setup cuentas APIs; 2. Modificar src/geo/geo_correlator.py; 3. Integración Google Earth; 4. Integración Sentinel; 5. Rate limiting real; 6. Cache optimizado,2 semanas,src/geo/geo_correlator.py (modificar cache simulado),
25O072-REQ-PEND-010,Integración App Principal con Jetson,PENDIENTE,CRITICA,Cliente HTTP robusto + failover + load balancing,Herramienta principal conectada a LLMs en Jetson AGX,1. Modificar src/utils/config.py para Jetson endpoint; 2. Cliente HTTP con retry logic; 3. Fallback a OpenAI si Jetson falla; 4. Health checks automáticos; 5. Load balancing requests; 6. Testing integración completa,2 semanas,"src/utils/config.py, src/models/llm_client.py (modificar)",
25O072-REQ-PEND-011,YOLO Real-Time en Jetson AGX,PENDIENTE,CRITICA,YOLO optimizado Jetson + TensorRT + streaming pipeline,YOLO ultra-rápido en Jetson - mejor que GPU desktop,1. Optimización YOLO para Jetson; 2. TensorRT engine conversion; 3. Streaming pipeline eficiente; 4. Integración con app principal; 5. Comparativa rendimiento; 6. Monitoring recursos,2 semanas,Jetson AGX + YOLO optimizado + streaming
25O072-REQ-PEND-003,Base Datos PostgreSQL+PostGIS,PENDIENTE,INMEDIATA,Servidor PostgreSQL + PostGIS + migración JSON,BD persistente - reemplazar archivos JSON actuales,1. Setup PostgreSQL+PostGIS; 2. Diseño schema geoespacial; 3. Scripts migración missions/*.json; 4. Modificar services para usar DB; 5. ORM integration; 6. Backup strategy,2 semanas,missions/ directory + todos los services
25O072-REQ-PEND-012,Monitoreo y Mantenimiento Jetson,PENDIENTE,CRITICA,Sistema monitoreo + alertas + backup automático,Jetson AGX operativa 24/7 - reliability empresarial,1. Setup Prometheus + Grafana; 2. Alertas temperatura/memoria/GPU; 3. Backup automático modelos; 4. Scripts mantenimiento; 5. Documentación operativa; 6. Procedures recovery,2 semanas,Sistema monitoreo + scripts mantenimiento
25O072-REQ-PEND-001,Integración SDK DJI Real,PENDIENTE,ALTA,Hardware DJI físico + SDK dji_asdk_to_python + Licencias,Control real drones DJI - reemplazar simulación actual,1. Adquisición hardware DJI; 2. Setup SDK desarrollo; 3. Modificar src/drones/dji_controller.py; 4. Testing vuelo real; 5. Validación telemetría real; 6. Documentación operativa,3 semanas,src/drones/dji_controller.py (modificar simulación)
25O072-REQ-PEND-005,YOLO Tiempo Real Video,FUTURO,MEDIA,GPU potente + optimización YOLO + streaming,YOLO en video streaming - mejorar video_processor actual,1. Optimización YOLO GPU; 2. Modificar src/processors/video_processor.py; 3. Real-time detection; 4. Buffer management GPU; 5. Performance tuning; 6. Integration tests,3 semanas,"src/processors/video_processor.py (optimizar), src/models/yolo_detector.py"
25O072-REQ-PEND-006,Deployment Kubernetes,PENDIENTE,BAJA,Cluster K8s + Helm + monitoring,Escalabilidad cloud - dockerizar sistema actual,1. K8s cluster setup; 2. Helm charts desde Dockerfile actual; 3. Services mesh; 4. CI/CD pipeline; 5. Monitoring/alerting; 6. Documentation ops,3 semanas,"Dockerfile, docker-compose.yml (base existente)"
25O072-REQ-PEND-007,Migración a Docker LLM Vision,PENDIENTE,CRITICA,Modelo LLM Vision local + Docker Hub + testing equivalencia,Reemplazar GPT-4.1 Vision OpenAI por modelo local - eliminar dependencia API externa,1. Research modelos LLM Vision disponibles Docker Hub; 2. Testing capacidades análisis geográfico; 3. Modificar src/models/geo_analyzer.py; 4. Ajustar prompts al nuevo modelo; 5. Validación precisión vs GPT-4.1; 6. Fallback automático,4 semanas,"src/models/geo_analyzer.py, src/utils/config.py (modificar provider)"
25O072-DOC-001,Documentación Técnica Completa,COMPLETADO,ALTA,15+ archivos MD + diagramas + APIs,Documentación profesional nivel empresarial,1. DESARROLLO_PROYECTO.md; 2. Módulos específicos (MODELS/GEO/DRONES/etc); 3. INFORME_REQUISITOS_COMPLETO.md; 4. README técnico; 5. Documentación APIs; 6. Diagramas arquitectura,60 horas,docs/ completo - 15+ archivos,2025-06-10
25O072-DOCKER-COMPLETE-001,Sistema Docker Completo con Dependencias,COMPLETADO,ALTA,Dockerfile Python 3.9-slim + OpenCV + PyTorch + YOLO 11 support,Containerización completa con todas las dependencias optimizadas para producción,1. FROM python:3.9-slim línea 1; 2. System dependencies OpenCV líneas 8-21; 3. Python dependencies requirements.txt líneas 29-31; 4. Ultralytics cache setup línea 34; 5. PYTHONPATH configuration línea 40; 6. Production command línea 46; 7. Docker Compose orchestration con port mapping 4001:5000,12 horas,Dockerfile (46 líneas) + docker-compose.yml (14 líneas),2025-02-18
25O072-CONTROLLERS-SYSTEM-001,Sistema Controladores Flask Blueprints,COMPLETADO,ALTA,4 controladores modulares con Blueprint pattern: Analysis + Drone + Mission + Geo,Controladores Flask modulares siguiendo patrón MVC con separation of concerns,1. analysis_controller.py (339 líneas) con 11 endpoints; 2. drone_controller.py con telemetría; 3. mission_controller.py con LLM; 4. geo_controller.py con triangulación; 5. Blueprint registration en main.py líneas 222-226; 6. Dependency injection init functions; 7. Error handling consistente todos controladores,50 horas,src/controllers/ (4 archivos ~800 líneas),2025-03-22
25O072-UTILS-SPECIALIZED-001,Utilidades Especializadas Procesamiento,COMPLETADO,ALTA,6 utilidades especializadas: YoloModelManager + ImageProcessor + ImageAnnotator + Config + Helpers + Formatters,Sistema utilidades con responsabilidades específicas y procesamiento avanzado,1. YoloModelManager (173 líneas) gestión modelo; 2. ImageProcessor OpenCV processing; 3. ImageAnnotator YOLO results; 4. Config.py multi-provider; 5. Helpers functions; 6. YoloResultFormatter; 7. Setup logging configuration,35 horas,src/utils/ (6+ archivos ~600 líneas),2025-03-15
25O072-MODELS-INTELLIGENT-001,Modelos Datos Inteligentes con IA,COMPLETADO,CRITICA,8 modelos inteligentes: GeoAnalyzer + YoloDetector + MissionPlanner + LLMClient + DataProcessors,Modelos datos con capacidades IA integradas y procesamiento inteligente,1. GeoAnalyzer (371 líneas) con GPT-4 Vision; 2. YoloDetector (220 líneas) coordinador; 3. MissionPlanner (138 líneas) con LLM; 4. LLMClient universal; 5. MissionDataProcessor; 6. CartographyManager GeoJSON; 7. PromptGenerator especializado; 8. Mission validation safety,65 horas,src/models/ (8+ archivos ~1500 líneas),2025-04-05
25O072-SERVICES-ENTERPRISE-001,Servicios Empresariales Capa Negocio,COMPLETADO,ALTA,5 servicios empresariales: AnalysisService + DroneService + MissionService + GeoService + ChatService,Capa servicios empresariales implementando lógica negocio con dependency injection,1. AnalysisService (410 líneas) hybrid analysis; 2. ChatService contextual post-analysis; 3. DroneService hardware abstraction; 4. MissionService LLM planning; 5. GeoService triangulation/correlation; 6. Service orchestration main.py líneas 119-135; 7. Dependency injection pattern,55 horas,src/services/ (5 archivos ~1200 líneas),2025-04-20
25O072-SECURITY-001,Validación Seguridad,COMPLETADO,CRITICA,Validators + safety checks + constraints,Seguridad vuelos automática,1. Mission validator; 2. Safety constraints; 3. Altitude limits; 4. Distance validation; 5. Battery checks; 6. Weather validation,30 horas,src/models/mission_validator.py + safety checks,2025-05-28
25O072-CACHE-001,Sistema Cache Inteligente,COMPLETADO,MEDIA,Cache satelital + resultados + optimización,Performance y eficiencia,1. Cache satelital images; 2. Cache analysis results; 3. Cache YOLO models; 4. Cache management; 5. Cleanup automático; 6. Performance metrics,20 horas,cache/ directory + src/geo/geo_correlator.py,2025-04-22
25O072-LOGGING-001,Sistema Logging Profesional,COMPLETADO,ALTA,Logging estructurado + rotación + niveles,Logging empresarial completo,1. Config logging; 2. Structured logs; 3. File rotation; 4. Multiple handlers; 5. Debug modes; 6. Performance logging,15 horas,src/utils/config.py + logs/ directory,2025-02-20
25O072-SESSION-001,Gestión Sesiones Web,COMPLETADO,MEDIA,Flask sessions + context + persistence,Sesiones usuario persistentes,1. Session management; 2. Analysis context; 3. Chat history; 4. User preferences; 5. Session persistence; 6. Cleanup sessions,25 horas,src/controllers/analysis_controller.py + session logic,2025-04-18
25O072-GEOSPATIAL-001,Análisis Geoespacial Avanzado,COMPLETADO,CRITICA,Triangulación + correlación + NED coordinates,Geolocalización militar precisión,1. Geo triangulation; 2. Satellite correlation; 3. NED coordinates; 4. GPS precision; 5. Multi-point analysis; 6. Error estimation,60 horas,src/geo/ completo - triangulation + correlation,2025-04-28
25O072-YOLO-ADVANCED-001,YOLO Avanzado + Anotaciones,COMPLETADO,ALTA,YOLO 11 + annotations + confidence + NMS,Detección objetos profesional,1. YOLO model manager; 2. Result formatter; 3. Image annotator; 4. Confidence tuning; 5. NMS optimization; 6. Class filtering,40 horas,src/models/yolo_detector.py + src/utils/yolo_*,2025-03-25
25O072-ARCHITECTURE-SOLID-001,Arquitectura SOLID Implementada,COMPLETADO,CRITICA,Refactorización completa siguiendo principios SOLID + Clean Architecture + Dependency Injection,Arquitectura empresarial siguiendo principios SOLID con separación responsabilidades,1. Single Responsibility: cada clase una responsabilidad; 2. Open/Closed: extensible sin modificar; 3. Liskov Substitution: herencia correcta; 4. Interface Segregation: interfaces específicas; 5. Dependency Inversion: dependency injection; 6. Factory pattern main.py; 7. Clean Architecture layers,80 horas,Todo src/ - refactoring arquitectural completo (~8000 líneas),2025-06-20
25O072-INTEGRATION-HYBRID-001,Integración Híbrida YOLO+GPT4 Contextual,COMPLETADO,CRITICA,Sistema análisis híbrido integrando YOLO object detection con GPT-4 Vision contextual,Análisis híbrido innovador combinando YOLO detection con contexto enriquecido GPT-4,1. Hybrid workflow analyze_image() analysis_service.py; 2. YOLO context extraction _get_yolo_context_for_geographic_analysis(); 3. Geographic indicators _extract_geographic_indicators(); 4. Prominent objects detection _get_prominent_objects(); 5. Context formatting _format_yolo_context() geo_analyzer.py; 6. Result fusion y enrichment; 7. Performance optimization,45 horas,src/services/analysis_service.py + src/models/geo_analyzer.py (~780 líneas),2025-04-20
25O072-TEMPLATES-WEB-001,Templates Web Profesionales Completos,COMPLETADO,ALTA,4 templates HTML profesionales: index.html (989 líneas) + drone_control + mission_instructions + web_index,Sistema templates web con interfaces especializadas y JavaScript interactivo,1. index.html principal (989 líneas) CSS avanzado; 2. drone_control.html panel control; 3. mission_instructions.html LLM interface; 4. web_index.html análisis rápido; 5. CSS Grid responsive; 6. JavaScript interactivo; 7. Leaflet maps integration,40 horas,src/templates/ (4 archivos ~3000 líneas),2025-06-18
25O072-INTEGRATION-OPENAI-001,Integración OpenAI GPT-4 Vision Robusta,COMPLETADO,CRITICA,Integración completa OpenAI con error handling + fallbacks + provider switching,Integración robusta OpenAI GPT-4 Vision con recuperación automática y manejo errores,1. OpenAI client setup líneas 35-49 geo_analyzer.py; 2. GPT-4 Vision requests _create_vision_request(); 3. Error handling + fallback _setup_openai_fallback(); 4. Provider switching config.py; 5. Response parsing robusto; 6. Rate limiting handling; 7. API key validation,25 horas,src/models/geo_analyzer.py + src/models/llm_client.py + src/utils/config.py (~400 líneas),2025-04-10
25O072-PERFORMANCE-001,Optimización Performance,COMPLETADO,ALTA,Threading + async + memory + GPU,Performance empresarial,1. Video processing threading; 2. Async operations; 3. Memory optimization; 4. GPU utilization; 5. Resource monitoring; 6. Bottleneck elimination,35 horas,src/processors/ + performance across modules,2025-06-25
25O072-PARROT-MIGRATION-001,Migración DJI a Parrot ANAFI,COMPLETADO,CRITICA,Migración completa de DJI SDK a Parrot Olympe SDK con simulación inteligente (452 líneas),Reemplazo completo del sistema de control de drones de DJI a Parrot ANAFI con SDK Olympe,1. Creación ParrotAnafiController heredando BaseDrone líneas 31-452; 2. Integración Olympe SDK con fallback simulación líneas 14-29; 3. Implementación todos métodos abstractos; 4. Telemetría completa Parrot líneas 160-190; 5. Control gimbal Parrot líneas 231-245; 6. Sistema simulación inteligente líneas 105-150; 7. Manejo errores y logging profesional,25 horas,src/drones/parrot_anafi_controller.py (452 líneas código nuevo),2025-07-18
25O072-UI-TELEMETRY-ENHANCED-001,Mejora UI Telemetría Avanzada,COMPLETADO,ALTA,Actualización interfaz con 15+ nuevos indicadores telemetría y controles (4723 líneas),Interfaz usuario mejorada con telemetría completa Roll/Pitch/Yaw + velocidades XYZ + GPS detallado,1. Indicadores orientación completa (Roll/Pitch/Yaw) líneas 1450-1461; 2. Velocidades individuales XYZ líneas 1463-1474; 3. GPS detallado satélites/fix líneas 1476-1486; 4. Voltaje batería líneas 1488-1497; 5. Estado vuelo armado/modo líneas 1499-1509; 6. Tiempo vuelo formato HH:MM:SS líneas 1511-1520; 7. Latencia comunicación líneas 1522-1531,20 horas,src/templates/drone_control.html (actualización ~500 líneas nuevas),2025-07-20
25O072-GIMBAL-CONTROL-001,Control Gimbal Interactivo,COMPLETADO,ALTA,Sistema control gimbal con joystick virtual y presets (150 líneas código),Control gimbal profesional con joystick táctil/mouse y presets rápidos,1. HTML joystick container líneas 1572-1597; 2. CSS joystick styling líneas 1350-1403; 3. JavaScript initializeGimbalControl() líneas 4416-4488; 4. Touch/mouse events handling; 5. Presets buttons (Centro/Abajo/Derecha/Izquierda); 6. Cálculo pitch/yaw desde joystick; 7. Integración API setGimbalPosition(),15 horas,src/templates/drone_control.html (gimbal section),2025-07-22
25O072-MISSION-HISTORY-001,Historial Misiones Completo,COMPLETADO,ALTA,Sistema historial misiones con filtros fecha/estado y acciones (200 líneas),Gestión completa historial misiones con tabla interactiva y filtros avanzados,1. HTML estructura historial líneas 1866-1898; 2. Filtros fecha/estado líneas 1868-1877; 3. Tabla misiones con columnas líneas 1879-1897; 4. JavaScript refreshMissionHistory() líneas 4491-4500; 5. displayMissionHistory() líneas 4502-4527; 6. filterMissionHistory() líneas 4529-4534; 7. Acciones ver detalles/replay,18 horas,src/templates/drone_control.html (history tab),2025-07-23
25O072-IMAGE-GALLERY-001,Galería Imágenes Capturas,COMPLETADO,ALTA,Sistema galería imágenes con selección múltiple y gestión (250 líneas),Galería visual capturas drone con gestión completa imágenes,1. HTML estructura galería líneas 1901-1915; 2. CSS grid gallery líneas 1467-1507; 3. JavaScript loadImageGallery() líneas 4539-4548; 4. displayImageGallery() líneas 4550-4588; 5. Selección múltiple selectAllImages() líneas 4590-4602; 6. Download/delete functions líneas 4604-4624; 7. Checkbox management con Set(),20 horas,src/templates/drone_control.html (gallery tab),2025-07-24
25O072-DATA-EXPORT-001,Sistema Exportación Datos,COMPLETADO,ALTA,Exportación datos telemetría multi-formato con heatmaps (300 líneas),Sistema profesional exportación datos con múltiples formatos y visualización heatmap,1. HTML opciones exportación líneas 1918-1963; 2. Checkboxes telemetría seleccionable líneas 1924-1929; 3. Formatos JSON/CSV/KML/GPX líneas 1933-1938; 4. JavaScript exportData() líneas 4627-4661; 5. Heatmap canvas visualization líneas 1953-1962; 6. generateHeatmap() líneas 4666-4675; 7. drawHeatmap() con gradientes líneas 4677-4702,22 horas,src/templates/drone_control.html (data tab),2025-07-25
25O072-TELEMETRY-JS-UPDATE-001,Actualización JavaScript Telemetría,COMPLETADO,CRITICA,JavaScript actualizado para manejar toda la nueva telemetría (150 líneas),Actualización completa función updateTelemetryDisplay() con todos nuevos datos,1. Orientación attitude handling líneas 3250-3259; 2. Velocidades XYZ líneas 3261-3270; 3. GPS satélites/fix líneas 3272-3283; 4. Voltaje batería líneas 3285-3292; 5. Estado vuelo armed/mode líneas 3294-3308; 6. Tiempo vuelo formatting líneas 3310-3318; 7. Latencia cálculo líneas 3320-3327,15 horas,src/templates/drone_control.html (updateTelemetryDisplay),2025-07-26
25O072-PARROT-DOCS-001,Documentación Parrot ANAFI,COMPLETADO,ALTA,Documentación completa migración Parrot con guías instalación (500+ líneas),Documentación técnica completa para Parrot ANAFI y Olympe SDK,1. Actualización MODULO_DRONES.md con Parrot líneas 118-210; 2. Creación INSTALACION_PARROT_OLYMPE.md completa; 3. Actualización README.md referencias Parrot; 4. Actualización DESARROLLO_PROYECTO.md; 5. Diagramas arquitectura Parrot; 6. Guías instalación ARM/x86; 7. Troubleshooting Olympe,25 horas,docs/INSTALACION_PARROT_OLYMPE.md + actualizaciones múltiples docs,2025-07-28
25O072-PARROT-TESTING-001,Tests Unitarios Parrot ANAFI,COMPLETADO,ALTA,Suite testing completa para ParrotAnafiController (180 líneas),Tests unitarios completos validando toda funcionalidad Parrot ANAFI,1. test_parrot_anafi_controller.py creación líneas 1-180; 2. Test inicialización líneas 12-19; 3. Test conexión simulada líneas 21-27; 4. Test despegue líneas 35-42; 5. Test movimiento líneas 44-57; 6. Test telemetría líneas 59-71; 7. Mock Olympe SDK handling,12 horas,tests/drones_test/test_parrot_anafi_controller.py (180 líneas),2025-07-30
