ID_Requisito,Nombre_Requisito,Estado_Actual,Prioridad,Descripcion_Tecnica,Implementacion_Real,Tareas_Especificas_Codigo,Horas_Reales,Archivos_Implementados,Fecha_Completado
25O072-OLYMPE-ERROR-FIX-001,Corrección Errores Importación Olympe,COMPLETADO,CRITICA,Corrección importaciones Olympe SDK para compatibilidad,Resolución errores críticos importación mensajes Olympe SDK,1. Fix GPSFixStateChanged namespace ardrone3.GPSSettingsState; 2. Eliminación import 'level' inexistente; 3. Research documentación Olympe oficial; 4. Testing importaciones corregidas; 5. Validación con Docker logs; 6. Documentación cambios; 7. Verificación funcionamiento simulación,8 horas,src/drones/parrot_anafi_controller.py (líneas 17-24),2025-08-01
25O072-CSS-COMPATIBILITY-001,Compatibilidad CSS Safari,COMPLETADO,MEDIA,Corrección CSS para compatibilidad Safari webkit,Mejora compatibilidad cross-browser añadiendo prefijos webkit,1. Añadir -webkit-backdrop-filter línea 1119; 2. Mantener backdrop-filter estándar línea 1120; 3. Testing Safari compatibility; 4. Validación otros browsers; 5. Performance verification; 6. Documentation CSS; 7. Future-proofing styles,3 horas,src/templates/drone_control.html (línea 1119-1120),2025-08-02
25O072-MAIN-UPDATE-001,Actualización main.py para Parrot,COMPLETADO,CRITICA,Modificación main.py para usar ParrotAnafiController en lugar de DJI,Actualización sistema principal para nueva arquitectura Parrot,1. Import ParrotAnafiController líneas 143-144; 2. Actualización _init_real_components línea 164; 3. Update components dict línea 173; 4. Verificación dependency injection; 5. Testing inicialización; 6. Logging updates; 7. Fallback handling,5 horas,src/main.py (3 cambios críticos),2025-07-19
25O072-REQUIREMENTS-UPDATE-001,Actualización Requirements Parrot,COMPLETADO,ALTA,Añadir parrot-olympe a requirements.txt,Actualización dependencias Python para soporte Parrot Olympe SDK,1. Añadir parrot-olympe>=7.7.0 línea 16; 2. Verificar compatibilidad versiones; 3. Testing pip install; 4. Docker build validation; 5. Documentation dependencies; 6. Version pinning strategy; 7. Fallback sin Olympe,2 horas,requirements.txt (1 línea nueva),2025-07-19
25O072-BASE-DRONE-UPDATE-001,Actualización Base Drone Docs,COMPLETADO,MEDIA,Actualización documentación y ejemplos para incluir Parrot,Actualización clase base para reflejar nuevo hardware soportado,1. Update docstring ejemplos Parrot líneas 15-30; 2. Actualización Pattern Components; 3. Ejemplos uso ParrotAnafiController; 4. Documentación herencia; 5. Abstract methods docs; 6. Usage examples update; 7. Design rationale update,3 horas,src/drones/base_drone.py (documentación),2025-07-20
25O072-TABS-NAVIGATION-001,Nuevas Pestañas Navegación UI,COMPLETADO,ALTA,Añadir 3 nuevas pestañas: Historial/Galería/Datos,Expansión sistema navegación con nuevas funcionalidades,1. Tab Historial línea 1606; 2. Tab Galería línea 1607; 3. Tab Datos línea 1608; 4. Event listeners tabs líneas 2528-2540; 5. Tab switching logic; 6. Active state management; 7. Content show/hide logic,8 horas,src/templates/drone_control.html (navigation),2025-07-21
25O072-GEO-TYPES-FIX-001,Corrección Tipos geo_correlator,COMPLETADO,BAJA,Fix anotaciones tipo Optional[str] en parámetros api_key y satellite_api_url,Corrección de tipos para compatibilidad estricta con type checking,1. Cambio api_key a Optional[str] línea 45; 2. Cambio satellite_api_url a Optional[str] línea 46; 3. Validación None checks líneas 89-92; 4. Update docstrings tipos; 5. Testing con mypy; 6. Verificación runtime; 7. Documentation update,0.5 horas,src/geo/geo_correlator.py (líneas 45-46),2025-05-15
25O072-TESTING-VALIDATION-001,Validación Empresarial Testing,COMPLETADO,ALTA,Validación final sistema testing con 95.3% éxito en 107 tests,Validación completa del framework de testing empresarial,1. Ejecución completa suite testing; 2. Análisis 107 tests services; 3. Verificación 95.3% success rate; 4. Identificación tests fallidos; 5. Documentación resultados; 6. Plan mejora cobertura; 7. Certificación QA,4 horas,tests/ completo - validación integral,2025-05-20
25O072-DEPLOYMENT-PROD-001,Deployment y Estabilización,COMPLETADO,ALTA,Configuración final producción y estabilización sistema completo,Deployment producción con optimizaciones y estabilización final,1. Configuración Waitress server líneas 247-252 main.py; 2. Environment variables prod; 3. Docker optimization; 4. Performance tuning; 5. Security hardening; 6. Load testing; 7. Monitoring setup,6 horas,main.py + docker-compose.yml + configuración producción,2025-06-25
25O072-SCRIPTS-GUIDE-001,Documentación Scripts Principal,COMPLETADO,MEDIA,Creación SCRIPTS_GUIDE.md con guía completa todos los scripts,Guía exhaustiva de navegación y uso de todos los scripts del proyecto,1. Análisis estructura proyecto; 2. Mapeo todos scripts Python; 3. Categorización por módulos; 4. Descripción funcionalidades; 5. Ejemplos uso; 6. Dependencias inter-scripts; 7. Best practices,2 horas,docs/SCRIPTS_GUIDE.md,2025-06-18
25O072-SCRIPTS-RELATIONS-001,Análisis Relaciones Módulos,COMPLETADO,MEDIA,Desarrollo SCRIPTS_RELATIONSHIPS.md con mapa dependencias detallado,Mapa completo de dependencias y relaciones entre todos los módulos,1. Análisis import statements; 2. Grafo dependencias; 3. Identificación ciclos; 4. Mapeo flujos datos; 5. Documentación interfaces; 6. Diagramas relaciones; 7. Recomendaciones arquitectura,2.5 horas,docs/SCRIPTS_RELATIONSHIPS.md,2025-06-18
25O072-SCRIPTS-OVERVIEW-001,Overview Arquitectura Scripts,COMPLETADO,MEDIA,Creación SCRIPTS_OVERVIEW.md con resumen conciso estructura,Resumen ejecutivo de la arquitectura y organización de scripts,1. Resumen arquitectura MVC; 2. Descripción capas sistema; 3. Flujos principales; 4. Componentes críticos; 5. Patrones diseño; 6. Quick reference; 7. Navegación rápida,1.5 horas,docs/SCRIPTS_OVERVIEW.md,2025-06-18
25O072-SCRIPTS-ANALYSIS-001,Análisis Técnico Scripts,COMPLETADO,MEDIA,Implementación SCRIPTS_ANALYSIS.md con análisis detallado funcionalidad,Análisis técnico profundo de funcionalidades y capacidades del sistema,1. Análisis funcional detallado; 2. Métricas código; 3. Complejidad ciclomática; 4. Coverage analysis; 5. Performance bottlenecks; 6. Security review; 7. Optimization opportunities,3 horas,docs/SCRIPTS_ANALYSIS.md,2025-06-18
25O072-SCRIPTS-DOCS-FINAL-001,Documentación Comprehensiva Final,COMPLETADO,ALTA,Desarrollo SCRIPTS_DOCUMENTATION.md con documentación exhaustiva completa,Documentación técnica completa y exhaustiva de todo el sistema,1. Documentación API completa; 2. Guías implementación; 3. Ejemplos código; 4. Troubleshooting guide; 5. FAQ técnico; 6. Migration guides; 7. Future roadmap,4 horas,docs/SCRIPTS_DOCUMENTATION.md,2025-06-18
25O072-REFACTOR-MISSION-001,Refactorización SOLID mission_planner,COMPLETADO,ALTA,Aplicación principios SOLID y Single Responsibility a mission_planner.py,Refactorización completa siguiendo Clean Architecture y SOLID principles,1. Análisis responsabilidades mission_planner líneas 1-138; 2. Extracción LLMClient clase independiente; 3. Extracción CartographyManager; 4. Extracción MissionDataProcessor; 5. Extracción PromptGenerator; 6. Refactor mission_planner líneas 38-82; 7. Testing refactorización,4.5 horas,src/models/mission_planner.py + 4 nuevas clases,2025-07-05
25O072-LLMCLIENT-001,Creación Clase LLMClient,COMPLETADO,MEDIA,Extracción lógica comunicación LLM a clase independiente con soporte multi-provider,Implementación LLMClient siguiendo Single Responsibility Principle,1. Diseño interface LLMClient; 2. Soporte OpenAI provider; 3. Soporte Docker models; 4. Error handling robusto; 5. Retry logic; 6. Response validation; 7. Unit tests LLMClient,1 hora,src/models/llm_client.py,2025-07-05
25O072-CARTOGRAPHY-001,Creación CartographyManager,COMPLETADO,MEDIA,Extracción lógica cartografía a clase independiente para carga procesamiento GeoJSON,Gestor cartografía especializado para manejo datos geoespaciales,1. Diseño CartographyManager class; 2. Carga archivos GeoJSON; 3. Búsqueda áreas por nombre; 4. Validación datos GeoJSON; 5. Cache cartografía; 6. Error handling; 7. Unit tests cartografía,1.5 horas,src/models/cartography_manager.py,2025-07-05
25O072-MISSIONDATA-001,Creación MissionDataProcessor,COMPLETADO,MEDIA,Extracción procesamiento datos misión a clase independiente,Procesador especializado para transformación y enriquecimiento datos misión,1. Diseño MissionDataProcessor; 2. Procesamiento waypoints; 3. Cálculo metadatos; 4. Validación datos misión; 5. Transformación formatos; 6. Enriquecimiento info; 7. Unit tests processor,1.5 horas,src/models/mission_data_processor.py,2025-07-05
25O072-PROMPTGEN-001,Creación PromptGenerator,COMPLETADO,BAJA,Extracción generación prompts a clase independiente,Generador prompts especializado para comunicación con LLMs,1. Diseño PromptGenerator; 2. Templates prompts; 3. Personalización contexto; 4. Validación prompts; 5. Optimización tokens; 6. Multiidioma support; 7. Unit tests generator,0.5 horas,src/models/prompt_generator.py,2025-07-05
